{
  "$schema": "https://json-schema.org/draft/2020-12/schema",
  "$id": "https://mhwiki.local/schemas/monster-dataset.v1.json",
  "title": "Monster dataset (one file per game)",
  "description": "Contract for assets/data/<game>/monsters.json. Cross-reference rules that JSON Schema cannot express (unique ids, partId/materialId/habitatId references, ranks allowed per game) are listed in data-model.md and enforced by the data layer.",
  "type": "object",
  "additionalProperties": false,
  "required": ["schemaVersion", "game", "generatedAt", "sources", "habitats", "materials", "monsters"],
  "properties": {
    "schemaVersion": { "const": 1 },
    "game": { "enum": ["world_iceborne", "rise_sunbreak", "wilds"] },
    "generatedAt": { "type": "string", "format": "date" },
    "sources": { "$ref": "#/$defs/sources" },
    "habitats": {
      "type": "array",
      "items": {
        "type": "object",
        "additionalProperties": false,
        "required": ["id", "name"],
        "properties": {
          "id": { "$ref": "#/$defs/slug" },
          "name": { "$ref": "#/$defs/localizedText" }
        }
      }
    },
    "materials": {
      "type": "array",
      "items": {
        "type": "object",
        "additionalProperties": false,
        "required": ["id", "name"],
        "properties": {
          "id": { "$ref": "#/$defs/slug" },
          "name": { "$ref": "#/$defs/localizedText" },
          "rarity": { "type": "integer", "minimum": 1, "maximum": 12 }
        }
      }
    },
    "monsters": {
      "type": "array",
      "items": { "$ref": "#/$defs/monster" }
    }
  },
  "$defs": {
    "slug": { "type": "string", "pattern": "^[a-z0-9]+(-[a-z0-9]+)*$" },
    "localizedText": {
      "type": "object",
      "additionalProperties": false,
      "required": ["en"],
      "properties": {
        "en": { "type": "string", "minLength": 1 },
        "ptBr": { "type": "string", "minLength": 1 }
      }
    },
    "effectiveness": { "enum": ["immune", "none", "low", "medium", "high"] },
    "elementMap": {
      "type": "object",
      "additionalProperties": false,
      "required": ["fire", "water", "thunder", "ice", "dragon"],
      "properties": {
        "fire": { "$ref": "#/$defs/effectiveness" },
        "water": { "$ref": "#/$defs/effectiveness" },
        "thunder": { "$ref": "#/$defs/effectiveness" },
        "ice": { "$ref": "#/$defs/effectiveness" },
        "dragon": { "$ref": "#/$defs/effectiveness" }
      }
    },
    "sources": {
      "type": "array",
      "minItems": 1,
      "items": {
        "type": "object",
        "additionalProperties": false,
        "required": ["name", "url"],
        "properties": {
          "name": { "type": "string", "minLength": 1 },
          "url": { "type": "string", "format": "uri", "pattern": "^https?://" },
          "notes": { "type": "string" }
        }
      }
    },
    "drop": {
      "type": "object",
      "additionalProperties": false,
      "required": ["materialId", "rank", "method"],
      "properties": {
        "materialId": { "$ref": "#/$defs/slug" },
        "rank": { "enum": ["low", "high", "master"] },
        "method": {
          "enum": ["carve", "tailCarve", "capture", "breakPart", "questReward", "droppedMaterial", "other"]
        },
        "methodLabel": { "$ref": "#/$defs/localizedText" },
        "partId": { "$ref": "#/$defs/slug" },
        "ratePercent": { "type": "number", "exclusiveMinimum": 0, "maximum": 100 }
      },
      "allOf": [
        {
          "if": { "properties": { "method": { "const": "breakPart" } } },
          "then": { "required": ["partId"] },
          "else": { "not": { "required": ["partId"] } }
        },
        {
          "if": { "properties": { "method": { "const": "other" } } },
          "then": { "required": ["methodLabel"] }
        }
      ]
    },
    "monster": {
      "type": "object",
      "additionalProperties": false,
      "required": ["slug", "name", "classification", "weaknesses", "habitatIds", "parts", "drops", "sources"],
      "properties": {
        "slug": { "$ref": "#/$defs/slug" },
        "name": { "$ref": "#/$defs/localizedText" },
        "classification": { "$ref": "#/$defs/localizedText" },
        "image": {
          "type": "string",
          "description": "Asset path relative to project root, e.g. assets/images/monsters/wilds/rathalos.webp"
        },
        "weaknesses": {
          "type": "object",
          "additionalProperties": false,
          "required": ["general"],
          "properties": {
            "general": { "$ref": "#/$defs/elementMap" },
            "states": {
              "type": "array",
              "items": {
                "type": "object",
                "additionalProperties": false,
                "required": ["id", "name", "values"],
                "properties": {
                  "id": { "$ref": "#/$defs/slug" },
                  "name": { "$ref": "#/$defs/localizedText" },
                  "values": { "$ref": "#/$defs/elementMap" }
                }
              }
            }
          }
        },
        "habitatIds": { "type": "array", "items": { "$ref": "#/$defs/slug" }, "uniqueItems": true },
        "parts": {
          "type": "array",
          "items": {
            "type": "object",
            "additionalProperties": false,
            "required": ["id", "name", "severable"],
            "properties": {
              "id": { "$ref": "#/$defs/slug" },
              "name": { "$ref": "#/$defs/localizedText" },
              "severable": { "type": "boolean" }
            }
          }
        },
        "drops": { "type": "array", "items": { "$ref": "#/$defs/drop" } },
        "sources": { "$ref": "#/$defs/sources" }
      }
    }
  }
}
