{
  "schemaVersion": 1,
  "game": "wilds",
  "generatedAt": "2026-09-29",
  "sources": [
    {
      "name": "Kiranico (MH Wilds)",
      "url": "https://mhwilds.kiranico.com/",
      "notes": "UNVERIFIED placeholder written from memory; must be checked against the source (tasks T058/T089)."
    }
  ],
  "habitats": [
    { "id": "windward-plains", "name": { "en": "Windward Plains" } }
  ],
  "materials": [
    { "id": "rathalos-scale", "name": { "en": "Rathalos Scale" } },
    { "id": "rathalos-tail", "name": { "en": "Rathalos Tail" } }
  ],
  "monsters": [
    {
      "slug": "rathalos",
      "name": { "en": "Rathalos", "ptBr": "Rathalos" },
      "classification": { "en": "Flying Wyvern" },
      "weaknesses": {
        "general": { "fire": "none", "water": "low", "thunder": "medium", "ice": "low", "dragon": "high" }
      },
      "habitatIds": ["windward-plains"],
      "parts": [
        { "id": "head", "name": { "en": "Head" }, "severable": false },
        { "id": "tail", "name": { "en": "Tail" }, "severable": true }
      ],
      "drops": [
        { "materialId": "rathalos-scale", "rank": "low", "method": "carve" },
        { "materialId": "rathalos-tail", "rank": "low", "method": "tailCarve" }
      ],
      "sources": [
        {
          "name": "Kiranico (MH Wilds)",
          "url": "https://mhwilds.kiranico.com/",
          "notes": "UNVERIFIED placeholder; habitat list and drop rates must be verified."
        }
      ]
    }
  ]
}
